{
  "schemaVersion": "research_run_v1",
  "runId": "tnm-manual-20260830202213",
  "agentVersion": "tnm-research-pipeline/1.7.3",
  "trigger": "manual",
  "mode": "discovery_batch",
  "scope": {
    "geography": "canada_first",
    "organizationKinds": [
      "company"
    ],
    "missionAreaSlugs": [],
    "technicalDomainSlugs": [
      "sensing-and-isr",
      "advanced-manufacturing-and-integration",
      "aerospace-and-mobility",
      "test-training-and-sustainment"
    ],
    "demandIssuerTypes": []
  },
  "selectedGap": {
    "coverageView": "demand",
    "dimension": "unmatched-demand:deep-strike",
    "reason": "The public deep strike demand requirement has no reviewed capability match in the local atlas.",
    "score": 850
  },
  "status": "completed",
  "osintArtifactsRequired": true,
  "startedAt": "2026-08-30T20:22:13.946Z",
  "completedAt": "2026-08-30T20:26:50.000Z",
  "limits": {
    "totalMinutes": 90,
    "sourceBookMinutes": 30,
    "maxQualifiedLeads": 25,
    "maxCandidates": 10,
    "minimumProspects": 40,
    "minimumSourceLanes": 6,
    "minimumCandidates": 8,
    "targetCandidates": 10
  },
  "sourceQueries": [
    "Deep-strike enabling-layer discovery wave 2 unmatched-demand:deep-strike Canada official site",
    "Deep-strike enabling-layer discovery wave 2 unmatched-demand:deep-strike Canada français official site",
    "Deep-strike enabling-layer discovery wave 2 unmatched-demand:deep-strike outcome constraint specification interface trial procurement Canada official site",
    "Deep-strike enabling-layer discovery wave 2 unmatched-demand:deep-strike Canada technical documents",
    "Deep-strike enabling-layer discovery wave 2 unmatched-demand:deep-strike Canada français technical documents",
    "Deep-strike enabling-layer discovery wave 2 unmatched-demand:deep-strike outcome constraint specification interface trial procurement Canada technical documents",
    "Deep-strike enabling-layer discovery wave 2 unmatched-demand:deep-strike Canada corporate registry",
    "Deep-strike enabling-layer discovery wave 2 unmatched-demand:deep-strike Canada français corporate registry",
    "Deep-strike enabling-layer discovery wave 2 unmatched-demand:deep-strike outcome constraint specification interface trial procurement Canada corporate registry",
    "Deep-strike enabling-layer discovery wave 2 unmatched-demand:deep-strike Canada patent ip",
    "Deep-strike enabling-layer discovery wave 2 unmatched-demand:deep-strike Canada français patent ip",
    "Deep-strike enabling-layer discovery wave 2 unmatched-demand:deep-strike outcome constraint specification interface trial procurement Canada patent ip",
    "Deep-strike enabling-layer discovery wave 2 unmatched-demand:deep-strike Canada government procurement",
    "Deep-strike enabling-layer discovery wave 2 unmatched-demand:deep-strike Canada français government procurement",
    "Deep-strike enabling-layer discovery wave 2 unmatched-demand:deep-strike outcome constraint specification interface trial procurement Canada government procurement",
    "Deep-strike enabling-layer discovery wave 2 unmatched-demand:deep-strike Canada proactive disclosure",
    "Deep-strike enabling-layer discovery wave 2 unmatched-demand:deep-strike Canada français proactive disclosure",
    "Deep-strike enabling-layer discovery wave 2 unmatched-demand:deep-strike outcome constraint specification interface trial procurement Canada proactive disclosure",
    "Deep-strike enabling-layer discovery wave 2 unmatched-demand:deep-strike Canada customer partner program",
    "Deep-strike enabling-layer discovery wave 2 unmatched-demand:deep-strike Canada français customer partner program",
    "Deep-strike enabling-layer discovery wave 2 unmatched-demand:deep-strike outcome constraint specification interface trial procurement Canada customer partner program",
    "Deep-strike enabling-layer discovery wave 2 unmatched-demand:deep-strike Canada industry publication",
    "Deep-strike enabling-layer discovery wave 2 unmatched-demand:deep-strike Canada français industry publication",
    "Deep-strike enabling-layer discovery wave 2 unmatched-demand:deep-strike outcome constraint specification interface trial procurement Canada industry publication",
    "Deep-strike enabling-layer discovery wave 2 unmatched-demand:deep-strike Canada ecosystem directory",
    "Deep-strike enabling-layer discovery wave 2 unmatched-demand:deep-strike Canada français ecosystem directory",
    "Deep-strike enabling-layer discovery wave 2 unmatched-demand:deep-strike outcome constraint specification interface trial procurement Canada ecosystem directory",
    "Deep-strike enabling-layer discovery wave 2 unmatched-demand:deep-strike Canada authenticated discovery feed",
    "Deep-strike enabling-layer discovery wave 2 unmatched-demand:deep-strike Canada français authenticated discovery feed",
    "Deep-strike enabling-layer discovery wave 2 unmatched-demand:deep-strike outcome constraint specification interface trial procurement Canada authenticated discovery feed",
    "Deep-strike enabling-layer discovery wave 2 unmatched-demand:deep-strike Canada bilingual public web",
    "Deep-strike enabling-layer discovery wave 2 unmatched-demand:deep-strike Canada français bilingual public web",
    "Deep-strike enabling-layer discovery wave 2 unmatched-demand:deep-strike outcome constraint specification interface trial procurement Canada bilingual public web"
  ],
  "counters": {
    "sourcesChecked": 30,
    "leadsQualified": 10,
    "leadsDeferred": 4,
    "candidatesCreated": 10,
    "duplicatesBlocked": 16,
    "prospectsDiscovered": 40,
    "uniqueProspects": 40,
    "prospectsQueued": 10,
    "recoveryAttempts": 60,
    "sourceLanesSearched": 9,
    "candidatesGreen": 6,
    "candidatesAmber": 4,
    "claimsCollected": 192,
    "claimsConflicted": 0,
    "coverageSubjects": 10
  },
  "underTargetReason": null,
  "exhaustionEvidence": null,
  "validation": {
    "passed": true,
    "errors": [],
    "warnings": [
      "Public evidence supports anti-jam positioning and a historical Canadian military-vehicle innovation contract; it does not establish current deep-strike integration, recent acceptance or production throughput.",
      "The cited federal project is historical and does not establish a current deep-strike component, weapon-platform adoption, configuration qualification or present production scale.",
      "The public record establishes a broad aerospace engineering offer but does not identify a current deep-strike program, customer outcome, delegated approval scope or configuration-specific acceptance.",
      "Public sources do not identify a deep-strike engine program, configuration-specific acceptance, current defence customer or test-cell delivery outcome.",
      "Public sources establish a certification and flight-test offer but do not identify the exact delegated scope for a proposed defence configuration or a deep-strike approval outcome.",
      "The federal record supports manufacturing modernization, not a deep-strike contract, defence-platform selection, current production capacity or configuration-specific acceptance.",
      "The NRC collaboration supports additive-manufacturing capability, not a current deep-strike component, weapon-platform qualification, production rate or accepted delivery outcome.",
      "Public sources do not identify a deep-strike platform, current defence contract, production availability or configuration-specific acceptance, and MHICA must remain distinct from MHI RJ Aviation.",
      "Public sources establish special-process capability but not a deep-strike component, current defence order, available capacity or configuration-specific acceptance.",
      "The federal investment record is historical and does not establish current defence orders, deep-strike relevance, available capacity or accepted configuration-specific performance."
    ]
  },
  "errors": [],
  "stopReason": "10 non-overlapping candidates reached low-yield saturation after 9 discovery lanes and were prepared only for private human review.",
  "outputs": {
    "collectionPlan": "research/ingestion/collection-plans-v1/tnm-manual-20260830202213.json",
    "claimLedger": "research/ingestion/claim-ledgers-v1/tnm-manual-20260830202213.json",
    "prospectInventory": "research/ingestion/prospect-inventories-v1/tnm-manual-20260830202213.json",
    "signalBatch": null,
    "candidateLogoPacket": "research/ingestion/local/candidate-logo-packets-v1/candidate-batch-tnm-manual-20260830202213.json",
    "sourceLeadBatch": "research/ingestion/source-leads-v2/tnm-manual-20260830202213.json",
    "candidateBatch": "research/ingestion/candidate-batches-v2/tnm-manual-20260830202213.json",
    "reviewPacket": "research/ingestion/reviews-v2/candidate-batch-tnm-manual-20260830202213.md",
    "stagingExport": "research/ingestion/staging/tnm-manual-20260830202213.json"
  }
}
