{
  "schemaVersion": "research_run_v1",
  "runId": "tnm-manual-20260806074419",
  "agentVersion": "tnm-research-pipeline/1.4.0",
  "trigger": "manual",
  "mode": "deep_dossier",
  "scope": {
    "geography": "canada_first",
    "organizationKinds": [
      "company"
    ],
    "missionAreaSlugs": [
      "edge-data-processing",
      "arctic-domain-awareness"
    ],
    "technicalDomainSlugs": [
      "communications-and-cyber",
      "mission-software-and-data",
      "advanced-manufacturing-and-integration",
      "aerospace-and-mobility",
      "test-training-and-sustainment"
    ],
    "demandIssuerTypes": []
  },
  "selectedGap": {
    "coverageView": "supply",
    "dimension": "named-deep-enrichment-e-3-targets",
    "reason": "Andrew requested a deep, review-first enrichment pass over 3 named published records with stronger evidence, decision-useful detail, clearer unknowns, and an actionable reviewer path.",
    "score": 980
  },
  "status": "completed",
  "osintArtifactsRequired": true,
  "startedAt": "2026-08-06T07:55:38.289Z",
  "completedAt": "2026-08-06T07:55:38.289Z",
  "limits": {
    "totalMinutes": 90,
    "sourceBookMinutes": 30,
    "maxQualifiedLeads": 25,
    "maxCandidates": 5,
    "minimumProspects": 1,
    "minimumSourceLanes": 3,
    "minimumCandidates": 1,
    "targetCandidates": 3
  },
  "sourceQueries": [
    "site:gdmissionsystems.ca General Dynamics Mission Systems–Canada land C4ISR and secure communications",
    "General Dynamics Mission Systems–Canada land C4ISR and secure communications Canada trial contract specifications",
    "General Dynamics Mission Systems–Canada land C4ISR and secure communications Canada capacité essai contrat",
    "site:magellan.aero Magellan Aerospace Canadian defence manufacturing",
    "Magellan Aerospace Canadian defence manufacturing Canada trial contract specifications",
    "Magellan Aerospace Canadian defence manufacturing Canada capacité essai contrat",
    "site:palaerospace.com PAL Aerospace RCAF training, missionization, and sustainment",
    "PAL Aerospace RCAF training, missionization, and sustainment Canada trial contract specifications",
    "PAL Aerospace RCAF training, missionization, and sustainment Canada capacité essai contrat"
  ],
  "counters": {
    "sourcesChecked": 15,
    "leadsQualified": 3,
    "leadsDeferred": 0,
    "candidatesCreated": 3,
    "duplicatesBlocked": 0,
    "prospectsDiscovered": 3,
    "uniqueProspects": 3,
    "prospectsQueued": 0,
    "recoveryAttempts": 9,
    "sourceLanesSearched": 3,
    "candidatesGreen": 0,
    "candidatesAmber": 3,
    "signalsExtracted": 3,
    "signalsDispositioned": 3,
    "sourceFamiliesSearched": 5,
    "claimsCollected": 3,
    "claimsConflicted": 0,
    "coverageSubjects": 3
  },
  "underTargetReason": null,
  "exhaustionEvidence": null,
  "validation": {
    "passed": true,
    "errors": [],
    "warnings": [
      "3 amber refresh candidates require human review before acceptance or publication.",
      "Mission and Public Need connections are derived; unresolved deployment, procurement, configuration, and readiness facts remain explicit."
    ]
  },
  "errors": [],
  "stopReason": null,
  "outputs": {
    "collectionPlan": "research/ingestion/collection-plans-v1/tnm-manual-20260806074419.json",
    "claimLedger": "research/ingestion/claim-ledgers-v1/tnm-manual-20260806074419.json",
    "prospectInventory": "research/ingestion/prospect-inventories-v1/tnm-manual-20260806074419.json",
    "signalBatch": "research/ingestion/signal-batches-v1/tnm-manual-20260806074419.json",
    "sourceLeadBatch": "research/ingestion/source-leads-v2/tnm-manual-20260806074419.json",
    "candidateBatch": "research/ingestion/candidate-batches-v2/tnm-manual-20260806074419.json",
    "reviewPacket": "research/ingestion/reviews-v2/candidate-batch-tnm-manual-20260806074419.md",
    "stagingExport": "research/ingestion/staging/tnm-manual-20260806074419.json"
  }
}
