{
  "schemaVersion": "research_run_v1",
  "runId": "tnm-manual-20260906074301",
  "agentVersion": "tnm-research-pipeline/1.8.0",
  "trigger": "manual",
  "mode": "dossier_enrichment",
  "scope": {
    "geography": "canada_first",
    "organizationKinds": [
      "company",
      "incubator"
    ],
    "missionAreaSlugs": [
      "arctic-domain-awareness",
      "underwater-isr",
      "autonomous-patrol-and-monitoring",
      "edge-data-processing"
    ],
    "technicalDomainSlugs": [
      "sensing-and-isr",
      "autonomous-systems",
      "mission-software-and-data",
      "space-and-earth-observation",
      "aerospace-and-mobility",
      "communications-and-cyber",
      "test-training-and-sustainment",
      "advanced-manufacturing-and-integration"
    ],
    "demandIssuerTypes": []
  },
  "selectedGap": {
    "coverageView": "ecosystem_support",
    "dimension": "dossier-targets:2",
    "reason": "The owner selected 2 exact published organizations for comprehensive, review-first organization-dossier enrichment without automatic activation or publication; the complete target identities are recorded in the collection plan.",
    "score": 1000
  },
  "status": "completed",
  "osintArtifactsRequired": true,
  "startedAt": "2026-09-06T07:43:01.879Z",
  "completedAt": "2026-09-06T08:00:31.919652Z",
  "limits": {
    "totalMinutes": 240,
    "sourceBookMinutes": 30,
    "maxQualifiedLeads": 50,
    "maxCandidates": 2,
    "minimumProspects": 2,
    "minimumSourceLanes": 3,
    "targetCandidates": 2
  },
  "sourceQueries": [
    "\"Kraken Robotics\" official Canada",
    "\"Kraken Robotics\" contract OR award OR trial OR deployment",
    "\"Kraken Robotics\" product platform technology specification interface deployment contract customer",
    "\"COVE\" official Canada",
    "\"COVE\" contract OR award OR trial OR deployment",
    "\"COVE\" program eligibility cohort service intake partner outcome application"
  ],
  "counters": {
    "sourcesChecked": 25,
    "leadsQualified": 2,
    "leadsDeferred": 0,
    "candidatesCreated": 2,
    "duplicatesBlocked": 0,
    "prospectsDiscovered": 2,
    "uniqueProspects": 2,
    "prospectsQueued": 0,
    "recoveryAttempts": 18,
    "sourceLanesSearched": 1,
    "candidatesGreen": 0,
    "candidatesAmber": 2,
    "signalsExtracted": 3,
    "signalsDispositioned": 3,
    "sourceFamiliesSearched": 4,
    "claimsCollected": 105,
    "claimsConflicted": 0,
    "coverageSubjects": 2
  },
  "underTargetReason": null,
  "exhaustionEvidence": null,
  "validation": {
    "passed": true,
    "errors": [],
    "warnings": [
      "Seven advisory warnings reviewed: three lineage/provenance notes, two collection-scope notes and two amber candidate summaries. Record-specific uncertainties remain visible in the candidates."
    ]
  },
  "errors": [],
  "stopReason": "Bounded dossier enrichment complete: two amber refresh candidates passed validation and non-writing smoke, were staged through the guarded finalizer, and reconciled as two distinct pending Admin Review candidates with zero publication markers or cross-run target overlap. Live Admin Review cards, source counts, proposed changes and editable rationales were inspected.",
  "outputs": {
    "collectionPlan": "research/ingestion/collection-plans-v1/tnm-manual-20260906074301.json",
    "claimLedger": "research/ingestion/claim-ledgers-v1/tnm-manual-20260906074301.json",
    "canonicalRepairSnapshot": null,
    "prospectInventory": "research/ingestion/prospect-inventories-v1/tnm-manual-20260906074301.json",
    "signalBatch": "research/ingestion/signal-batches-v1/tnm-manual-20260906074301.json",
    "sourceLeadBatch": "research/ingestion/source-leads-v2/tnm-manual-20260906074301.json",
    "candidateBatch": "research/ingestion/candidate-batches-v2/tnm-manual-20260906074301.json",
    "reviewPacket": "research/ingestion/reviews-v2/tnm-manual-20260906074301-candidates.md",
    "stagingExport": "research/ingestion/staging/tnm-manual-20260906074301.json"
  }
}
