{
  "schemaVersion": "research_run_v1",
  "runId": "tnm-manual-20260825110528",
  "agentVersion": "tnm-research-pipeline/1.7.3",
  "trigger": "manual",
  "mode": "dossier_enrichment",
  "scope": {
    "geography": "canada_first",
    "organizationKinds": [
      "company"
    ],
    "missionAreaSlugs": [
      "arctic-domain-awareness",
      "underwater-isr",
      "autonomous-patrol-and-monitoring",
      "edge-data-processing"
    ],
    "technicalDomainSlugs": [
      "sensing-and-isr",
      "autonomous-systems",
      "mission-software-and-data",
      "space-and-earth-observation",
      "aerospace-and-mobility",
      "communications-and-cyber",
      "test-training-and-sustainment",
      "advanced-manufacturing-and-integration"
    ],
    "demandIssuerTypes": []
  },
  "selectedGap": {
    "coverageView": "supply",
    "dimension": "dossier-targets:1",
    "reason": "The owner selected one exact published True North Marine record for comprehensive review-first enrichment without autonomous acceptance or publication.",
    "score": 1000
  },
  "status": "completed",
  "osintArtifactsRequired": true,
  "startedAt": "2026-08-25T11:05:28.350Z",
  "completedAt": "2026-08-25T11:33:21.192Z",
  "limits": {
    "totalMinutes": 240,
    "sourceBookMinutes": 30,
    "maxQualifiedLeads": 50,
    "maxCandidates": 1,
    "minimumProspects": 1,
    "minimumSourceLanes": 3,
    "targetCandidates": 1
  },
  "sourceQueries": [
    "site:tnmservices.com True North Marine OptiNav services order",
    "site:accelleron.com OptiNav LOREKA360 COFCO 2025",
    "Quebec enterprise register True North Marine Accelleron Canada merger",
    "site:seacargocharter.org COFCO True North Marine Accelleron Canada",
    "site:whaleguardians.org Accelleron routing API June 2026",
    "site:ivado.ca True North Marine OptiNav",
    "site:cors.ca True North Marine Weather Routing",
    "site:mitacs.ca True North Marine voyage route optimization",
    "site:search.open.canada.ca/contracts \"True North Marine\"",
    "\"True North Marine\" OptiNav defence government certification customer"
  ],
  "counters": {
    "sourcesChecked": 48,
    "leadsQualified": 1,
    "leadsDeferred": 0,
    "candidatesCreated": 1,
    "duplicatesBlocked": 0,
    "prospectsDiscovered": 1,
    "uniqueProspects": 1,
    "prospectsQueued": 1,
    "recoveryAttempts": 10,
    "sourceLanesSearched": 1,
    "candidatesGreen": 0,
    "candidatesAmber": 1,
    "signalsExtracted": 2,
    "signalsDispositioned": 2,
    "sourceFamiliesSearched": 2,
    "claimsCollected": 91,
    "claimsConflicted": 0,
    "coverageSubjects": 1
  },
  "underTargetReason": null,
  "exhaustionEvidence": {
    "sourceLanes": [
      "official_directory",
      "technical_documentation",
      "corporate_registry",
      "patent_ip",
      "procurement",
      "government_program",
      "customer_partner",
      "industry_association",
      "bilingual_web",
      "broad_web"
    ],
    "prospectsConsidered": 1,
    "unresolvedTrails": [
      "No public source establishes a named government or defence OptiNav deployment, security accreditation, classified handling or regulatory certification.",
      "Public sources do not disclose API schemas, authentication, authorization, data residency, retention, offline operation, service levels or full integration dependencies.",
      "COFCO trial metrics remain Accelleron-reported, and Whale Guardians testing does not establish a production OptiNav feature or customer deployment."
    ],
    "note": "Collection covered current official, technical, registry, IP, procurement, proactive-disclosure, customer, partner, research, professional-society and bilingual lanes; final customer, certification and current-product passes yielded no new candidate-changing evidence."
  },
  "validation": {
    "passed": true,
    "errors": [],
    "warnings": [
      "The Québec register confirms the legal merger and current trade name, but reviewed public sources do not explain how legacy TNM contracts, customer notices or data-controller obligations transitioned.",
      "Sea Cargo Charter confirms the COFCO service-provider relationship but does not independently validate Accelleron's 13-voyage fuel, emissions or cost-savings figures or their baseline.",
      "Whale Guardians reports that its API is live and under Accelleron testing; this does not establish a production OptiNav feature, customer deployment or measured effectiveness.",
      "No named government or defence OptiNav customer, public-sector trial, security accreditation, classified-data handling, naval integration or regulatory certification was found.",
      "Public product sources identify inputs and API examples but not API schemas, authentication, authorization, data residency, retention, offline operation, availability, service levels or complete integration dependencies.",
      "The IMarEST nature-routing case is a simulation under stated assumptions, not an operational deployment or a forecast of customer outcomes.",
      "Historical IVADO beta savings, current vendor headline figures and Accelleron's COFCO trial use different samples and should not be combined into one performance claim."
    ]
  },
  "errors": [],
  "stopReason": "Completed one comprehensive, source-verified True North Marine dossier refresh for private Admin Review.",
  "outputs": {
    "collectionPlan": "research/ingestion/collection-plans-v1/tnm-manual-20260825110528.json",
    "claimLedger": "research/ingestion/claim-ledgers-v1/tnm-manual-20260825110528.json",
    "prospectInventory": "research/ingestion/prospect-inventories-v1/tnm-manual-20260825110528.json",
    "signalBatch": "research/ingestion/signal-batches-v1/tnm-manual-20260825110528.json",
    "candidateLogoPacket": null,
    "sourceLeadBatch": "research/ingestion/source-leads-v2/tnm-manual-20260825110528.json",
    "candidateBatch": "research/ingestion/candidate-batches-v2/tnm-manual-20260825110528.json",
    "reviewPacket": null,
    "stagingExport": null
  }
}
